{
	"$defs": {
		"acronym": {
			"pattern": "^[A-Z]{3}$",
			"type": "string"
		},
		"hex_color": {
			"pattern": "^#[A-Fa-f0-9]{6}$",
			"type": "string"
		},
		"icon_name": {
			"minLength": 1,
			"pattern": "^[a-z][a-z0-9-_]*$",
			"type": "string"
		},
		"non_empty": {
			"minLength": 1,
			"type": "string"
		},
		"available_icons": {
			"items": {
				"$ref": "#/$defs/icon_name"
			},
			"type": "array",
			"uniqueItems": true
		},
		"card_appearance": {
			"additionalProperties": true,
			"properties": {
				"acronym": {
					"$ref": "#/$defs/acronym"
				},
				"shape": {
					"$ref": "#/$defs/non_empty"
				},
				"fill": {
					"$ref": "#/$defs/hex_color"
				},
				"stroke": {
					"$ref": "#/$defs/hex_color"
				},
				"color": {
					"$ref": "#/$defs/hex_color"
				},
				"text": {
					"$ref": "#/$defs/hex_color"
				},
				"icon": {
					"$ref": "#/$defs/icon_name",
					"description": "Optional SVG group id from available_icons."
				}
			},
			"required": ["acronym", "shape", "fill"],
			"type": "object",
			"anyOf": [{ "required": ["stroke"] }, { "required": ["color"] }]
		},
		"cards": {
			"items": {
				"$ref": "#/$defs/card_appearance"
			},
			"type": "array",
			"uniqueItems": true
		},
		"card_type_list": {
			"items": {
				"$ref": "#/$defs/acronym"
			},
			"minItems": 1,
			"type": "array",
			"uniqueItems": true
		},
		"view_subdomain_definition": {
			"additionalProperties": false,
			"properties": {
				"cards": {
					"$ref": "#/$defs/card_type_list"
				},
				"subsubdomains": {
					"additionalProperties": {
						"$ref": "#/$defs/card_type_list"
					},
					"type": "object"
				}
			},
			"type": "object"
		},
		"view_domain_definition": {
			"additionalProperties": false,
			"properties": {
				"cards": {
					"$ref": "#/$defs/card_type_list"
				},
				"subdomains": {
					"additionalProperties": {
						"$ref": "#/$defs/view_subdomain_definition"
					},
					"type": "object"
				}
			},
			"type": "object"
		},
		"layout_family": {
			"enum": ["TreeTopDown", "TreeLeftRight"],
			"type": "string"
		},
		"view_definition": {
			"additionalProperties": false,
			"properties": {
				"description": {
					"$ref": "#/$defs/non_empty"
				},
				"included_card_types": {
					"$ref": "#/$defs/card_type_list"
				},
				"layout": {
					"$ref": "#/$defs/layout_family",
					"description": "Optional preferred layout family for rendering this view."
				},
				"name": {
					"$ref": "#/$defs/non_empty"
				},
				"root_card_types": {
					"$ref": "#/$defs/card_type_list"
				}
			},
			"required": ["name", "description", "root_card_types", "included_card_types"],
			"type": "object"
		},
		"views": {
			"description": "List of view definitions",
			"items": {
				"$ref": "#/$defs/view_definition"
			},
			"minItems": 1,
			"type": "array",
			"uniqueItems": true
		}
	},
	"$id": "https://crystultima.org/aurora/viewconfiguration.schema.json",
	"$schema": "https://json-schema.org/draft/2020-12/schema",
	"additionalProperties": true,
	"description": "Schema for Aurora.viewconfiguration.json with rendering appearance and available icon definitions.",
	"properties": {
		"$schema": {
			"minLength": 1,
			"type": "string"
		},
		"version": {
			"$ref": "#/$defs/non_empty"
		},
		"available_icons": {
			"$ref": "#/$defs/available_icons"
		},
		"cards": {
			"$ref": "#/$defs/cards"
		},
		"domains": {
			"additionalProperties": {
				"$ref": "#/$defs/view_domain_definition"
			},
			"type": "object"
		},
		"views": {
			"$ref": "#/$defs/views"
		}
	},
	"required": ["available_icons", "cards", "views"],
	"title": "Aurora View Configuration Schema",
	"type": "object"
}
