{
  "$schema": "../schemas/Aurora.viewconfiguration.schema.json",
  "available_icons": [
    "alarm",
    "anchor",
    "audio",
    "balance_scale",
    "bank",
    "bar_chart",
    "battery",
    "battery_low",
    "beetle",
    "bell",
    "biohazard",
    "bolt",
    "bomb",
    "books",
    "box",
    "brick",
    "bulb",
    "card",
    "card_file_box",
    "card_index",
    "card_index_dividers",
    "chains",
    "chart_decreasing",
    "chart_increasing",
    "check",
    "chequered_flag",
    "circle_red",
    "classical_building",
    "clock",
    "clockwise_vertical_arrows",
    "closed_book",
    "cloud",
    "collision",
    "commercial",
    "compass",
    "construction",
    "control_knobs",
    "copyright",
    "corner_square",
    "counterclockwise_arrows_button",
    "crane",
    "cross_mark_button",
    "crossed_swords",
    "desktop",
    "diamond",
    "diskette",
    "dollarsign",
    "double_exclamation_mark",
    "earth",
    "electric_plug",
    "email",
    "exclamation",
    "exclamation_question_mark",
    "filing_cabinet",
    "flag_red",
    "folder",
    "folder_open",
    "gear",
    "globe_with_meridians",
    "group",
    "hammer",
    "hammer_and_pick",
    "hammer_and_wrench",
    "hook",
    "hourglass",
    "inbox_tray",
    "industrial",
    "key",
    "laptop",
    "large_blue_diamond",
    "large_orange_diamond",
    "ledger",
    "level_slider",
    "lifepreserver",
    "link",
    "lock",
    "lock_and_key",
    "locked_pen",
    "magic_wand",
    "magnifying_glass_tilted_left",
    "memo",
    "mobile",
    "moneybag",
    "no_entry",
    "no_passing_fire",
    "office",
    "outbox_tray",
    "page_facing_up",
    "pen_black",
    "pen_blue",
    "person",
    "pick",
    "pirate_flag",
    "police_car_light",
    "ppe",
    "printer",
    "prohibited",
    "puzzle_piece",
    "question",
    "radiation",
    "receipt",
    "recycle",
    "red_triangle_pointed_down",
    "red_triangle_pointed_up",
    "registered",
    "repeat_button",
    "rescue_workers_helmet",
    "robot",
    "safety_vest",
    "school",
    "screwdriver",
    "search",
    "shield",
    "skull_and_crossbones",
    "speaker_high_volume",
    "spider_web",
    "spiral_calendar",
    "star",
    "stop_sign",
    "stopwatch",
    "straight_ruler",
    "tag",
    "target",
    "thermometer",
    "toolbox",
    "trash_basket",
    "unlocked",
    "vertical_traffic_light",
    "video",
    "warning",
    "wheelchair_symbol",
    "wrench"
  ],
  "cards": [
    {
      "acronym": "ATV",
      "fill": "#4c1d95",
      "icon": "hammer",
      "shape": "double-rectangle",
      "stroke": "#000000",
      "text": "#FFFFFF"
    },
    {
      "acronym": "ACT",
      "fill": "#1a2e05",
      "icon": "person",
      "shape": "rounded-rectangle",
      "stroke": "#000000",
      "text": "#FFFFFF"
    },
    {
      "acronym": "STK",
      "fill": "#1a2e05",
      "icon": "group",
      "shape": "rounded-rectangle",
      "stroke": "#000000",
      "text": "#FFFFFF"
    },
    {
      "acronym": "ADR",
      "fill": "#1f2937",
      "icon": "straight_ruler",
      "shape": "ruler",
      "stroke": "#000000",
      "text": "#FFFFFF"
    },
    {
      "acronym": "ART",
      "fill": "#1e293b",
      "icon": "page_facing_up",
      "shape": "document",
      "stroke": "#000000",
      "text": "#FFFFFF"
    },
    {
      "acronym": "AST",
      "fill": "#334155",
      "icon": "lock_and_key",
      "shape": "document",
      "stroke": "#000000",
      "text": "#FFFFFF"
    },
    {
      "acronym": "DAR",
      "fill": "#0f766e",
      "icon": "diskette",
      "shape": "document",
      "stroke": "#000000",
      "text": "#FFFFFF"
    },
    {
      "acronym": "CAP",
      "fill": "#052e16",
      "shape": "rounded-rectangle",
      "stroke": "#000000",
      "text": "#FFFFFF"
    },
    {
      "acronym": "SYS",
      "fill": "#1e40af",
      "icon": "robot",
      "shape": "folder",
      "stroke": "#000000",
      "text": "#FFFFFF"
    },
    {
      "acronym": "APP",
      "fill": "#1e40af",
      "icon": "crane",
      "shape": "rectangle",
      "stroke": "#000000",
      "text": "#FFFFFF"
    },
    {
      "acronym": "COM",
      "fill": "#1e40af",
      "icon": "puzzle_piece",
      "shape": "component",
      "stroke": "#000000",
      "text": "#FFFFFF"
    },
    {
      "acronym": "DST",
      "fill": "#5b21b6",
      "shape": "cylinder",
      "stroke": "#000000",
      "text": "#FFFFFF"
    },
    {
      "acronym": "CON",
      "fill": "#422006",
      "icon": "large_blue_diamond",
      "shape": "diamond",
      "stroke": "#000000",
      "text": "#FFFFFF"
    },
    {
      "acronym": "CNS",
      "fill": "#082f49",
      "icon": "stop_sign",
      "shape": "ruler",
      "stroke": "#000000",
      "text": "#FFFFFF"
    },
    {
      "acronym": "CTL",
      "fill": "#713f12",
      "icon": "shield",
      "shape": "ruler",
      "stroke": "#000000",
      "text": "#FFFFFF"
    },
    {
      "acronym": "EXC",
      "fill": "#9a3412",
      "icon": "memo",
      "shape": "ruler",
      "stroke": "#000000",
      "text": "#FFFFFF"
    },
    {
      "acronym": "DEP",
      "fill": "#1e1b4b",
      "icon": "red_triangle_pointed_up",
      "shape": "octagon",
      "stroke": "#000000",
      "text": "#FFFFFF"
    },
    {
      "acronym": "DSR",
      "fill": "#0e7490",
      "shape": "cylinder",
      "stroke": "#000000",
      "text": "#FFFFFF"
    },
    {
      "acronym": "DRI",
      "fill": "#064e3b",
      "icon": "compass",
      "shape": "rounded-rectangle",
      "stroke": "#000000",
      "text": "#FFFFFF"
    },
    {
      "acronym": "EVT",
      "fill": "#5b21b6",
      "icon": "alarm",
      "shape": "trapezoid",
      "stroke": "#000000",
      "text": "#FFFFFF"
    },
    {
      "acronym": "FEA",
      "fill": "#14532d",
      "icon": "level_slider",
      "shape": "rectangle",
      "stroke": "#000000",
      "text": "#FFFFFF"
    },
    {
      "acronym": "INT",
      "fill": "#102080",
      "icon": "electric_plug",
      "shape": "interface",
      "stroke": "#000000",
      "text": "#FFFFFF"
    },
    {
      "acronym": "API",
      "fill": "#0f3d91",
      "icon": "cloud",
      "shape": "interface",
      "stroke": "#000000",
      "text": "#FFFFFF"
    },
    {
      "acronym": "MIS",
      "fill": "#022c22",
      "icon": "anchor",
      "shape": "octagon",
      "stroke": "#000000",
      "text": "#FFFFFF"
    },
    {
      "acronym": "NOD",
      "fill": "#312e81",
      "icon": "desktop",
      "shape": "box",
      "stroke": "#000000",
      "text": "#FFFFFF"
    },
    {
      "acronym": "PRD",
      "fill": "#581c87",
      "icon": "large_orange_diamond",
      "shape": "diamond",
      "stroke": "#000000",
      "text": "#FFFFFF"
    },
    {
      "acronym": "PRO",
      "fill": "#2e1065",
      "icon": "repeat_button",
      "shape": "octagon",
      "stroke": "#000000",
      "text": "#FFFFFF"
    },
    {
      "acronym": "REQ",
      "fill": "#065f46",
      "icon": "check",
      "shape": "rounded-rectangle",
      "stroke": "#000000",
      "text": "#FFFFFF"
    },
    {
      "acronym": "RIS",
      "fill": "#881337",
      "icon": "warning",
      "shape": "hexagon",
      "stroke": "#000000",
      "text": "#FFFFFF"
    },
    {
      "acronym": "STA",
      "fill": "#701a75",
      "icon": "tag",
      "shape": "ellipse",
      "stroke": "#000000",
      "text": "#FFFFFF"
    },
    {
      "acronym": "STM",
      "fill": "#4a044e",
      "icon": "gear",
      "shape": "octagon",
      "stroke": "#000000",
      "text": "#FFFFFF"
    },
    {
      "acronym": "STR",
      "fill": "#365314",
      "icon": "card",
      "shape": "rectangle",
      "stroke": "#000000",
      "text": "#FFFFFF"
    },
    {
      "acronym": "TES",
      "fill": "#022c22",
      "icon": "ppe",
      "shape": "hexagon",
      "stroke": "#000000",
      "text": "#FFFFFF"
    },
    {
      "acronym": "THD",
      "fill": "#4c0519",
      "icon": "diamond",
      "shape": "diamond",
      "stroke": "#000000",
      "text": "#FFFFFF"
    },
    {
      "acronym": "ADV",
      "fill": "#4c0519",
      "icon": "pirate_flag",
      "shape": "rounded-rectangle",
      "stroke": "#000000",
      "text": "#FFFFFF"
    },
    {
      "acronym": "THC",
      "fill": "#4c0519",
      "icon": "bomb",
      "shape": "rounded-rectangle",
      "stroke": "#000000",
      "text": "#FFFFFF"
    },
    {
      "acronym": "VIC",
      "fill": "#4c0519",
      "icon": "target",
      "shape": "rounded-rectangle",
      "stroke": "#000000",
      "text": "#FFFFFF"
    },
    {
      "acronym": "ROW",
      "fill": "#4c0519",
      "icon": "key",
      "shape": "rounded-rectangle",
      "stroke": "#000000",
      "text": "#FFFFFF"
    },
    {
      "acronym": "THM",
      "fill": "#4c0519",
      "icon": "no_passing_fire",
      "shape": "octagon",
      "stroke": "#000000",
      "text": "#FFFFFF"
    },
    {
      "acronym": "TRG",
      "fill": "#78350f",
      "icon": "bolt",
      "shape": "trapezoid",
      "stroke": "#000000",
      "text": "#FFFFFF"
    },
    {
      "acronym": "VND",
      "fill": "#1a2e05",
      "icon": "office",
      "shape": "rounded-rectangle",
      "stroke": "#000000",
      "text": "#FFFFFF"
    }
  ],
  "domains": {
    "Governance": {
      "cards": [
        "MIS",
        "DRI",
        "STK"
      ],
      "subdomains": {
        "Process": {
          "cards": [
            "PRO"
          ],
          "subsubdomains": {
            "ProcessSteps": [
              "ATV",
              "ACT",
              "CON",
              "TRG"
            ]
          }
        },
        "Requirements": {
          "cards": [
            "EXC",
            "TES",
            "ADR",
            "CTL",
            "CAP",
            "CNS",
            "FEA",
            "REQ",
            "STR"
          ]
        },
        "Risk": {
          "cards": [